{
  "$schema": "./panel.schema.json",
  "collection": {
    "id": "aabc-bura-ceramics",
    "title": "AABC Bura Ceramics — Research Panels",
    "subtitle": "Funerary terracotta of the Bura-Asinda-Sikka culture, Niger River valley (c. 3rd–13th century CE)",
    "anchorArtifact": "AABC Bura clay jar-top face (anthropomorphic vessel cap / grave marker)",
    "anchorArtifactSource": {
      "institution": "The Metropolitan Museum of Art, New York",
      "object": "Grave Marker, Bura peoples, Niger",
      "date": "3rd–11th century",
      "medium": "Terracotta, H. 31.5 in (80 cm)",
      "accession": "1998.478.1",
      "creditLine": "Gift of Jerome Vogel, 1998",
      "license": "Public Domain (CC0 — The Met Open Access)",
      "url": "https://www.metmuseum.org/art/collection/search/317898",
      "note": "The Bura ceramic face used in the existing 3D scene corresponds to this Met grave marker. Met Open Access images are CC0 and may be displayed/reused."
    },
    "purpose": "Source content for a set of gallery wall panels/posters. Each panel object below maps to one physical poster; the display pulls title, description, body, images and sources from its record.",
    "version": "1.1.0",
    "generated": "2026-06-28",
    "researchMethod": "Web research via Tavily (search + image retrieval), June 2026.",
    "curatorialNotes": [
      "Dating is reported inconsistently across sources: Wikipedia/UNESCO frame the Bura culture as 'first-millennium'; Grokipedia and several galleries give 3rd–13th c. CE; the Mulvane Art Museum cites 2nd–11th c. CE from stratigraphy. Panels use 'c. 3rd–13th century CE' with a note, and should be finalised against a primary source (Gado 1993).",
      "Discovery: accidentally found 1975 (terracotta head[s]) near Bura-Asinda-Sikka; reported to IRSH, University of Niamey; first small dig 1978; first systematic excavation 1983 led by Boubé Gado. Some sources name the finder as villager Abdurahman Sindy.",
      "Coordinates differ by source. Wikipedia gives 13°53′53″N 1°02′20″E (13.898, 1.039); Grokipedia gives ~13°50′N 0°30′E. Use the Wikipedia value as primary and verify against Niger heritage records before printing a precise pin."
    ],
    "imageLicensingPolicy": "Image URLs are research references only. Museum/Wikimedia images may be reusable under CC/open-access terms (verify per item); auction-house and commercial-gallery images are NOT cleared for reproduction. Confirm rights/credit for every image before it is printed on a panel. Prefer open-access (Wikimedia Commons, museum open-access) or commission original illustrations for A/C/D.",
    "demoUsagePolicy": "This panel set is assembled for an in-engine DEMONSTRATION, not for publication or printed distribution. Cleared visuals: the four Met 'Bura peoples' objects are Public Domain (CC0, Met Open Access) and are downloaded into ./assets for same-origin display — these are safe to show and reuse. Un-cleared visuals (auction/commercial/editorial photos, and the site map) are shown only as low-resolution references for the demo and carry a 'usageNote'; the renderer stamps those panels 'For demo purposes only — not for distribution'. Replace or clear every flagged image before any public, printed, or distributed use."
  },
  "schema": {
    "description": "Field definitions for each panel record.",
    "fields": {
      "id": "Short panel code (A–F) used to order/lay out the wall.",
      "name": "Machine slug for the panel (kebab-case); stable key the display binds to.",
      "title": "Headline shown on the poster.",
      "subtitle": "Optional secondary line under the title.",
      "format": "Intended visual treatment (e.g. 'Sepia topographic illustration').",
      "panelCaption": "One-line caption/standfirst for the poster.",
      "description": "Short summary (≈40–80 words) — the primary readable block on the panel.",
      "body": "Longer narrative (optional) for posters that carry more text or a back-of-card.",
      "keyFacts": "Bulleted facts suitable for a sidebar or fact strip.",
      "images": "Array of image references: { url, caption, credit, license, role }. role ∈ hero|supporting|reference.",
      "sources": "Array of citations: { name, title, url, publisher }. 'name' is a short label; include at least one source link per panel.",
      "design": "Display hints: { palette, layout, illustration } to guide the panel designer.",
      "status": "Production state: draft | needs-image-clearance | needs-illustration | ready."
    }
  },
  "panels": [
    {
      "id": "A",
      "name": "site-location-geography",
      "placardLabel": "Bura Placard A",
      "heroHeight": 680,
      "title": "A Bend in the Niger",
      "subtitle": "Where the Bura culture buried its dead",
      "format": "Sepia topographic illustration",
      "panelCaption": "Bura-Asinda-Sikka sits on a terrace of the middle Niger River valley in south-west Niger.",
      "description": "The Bura necropolis lies in the Tillabéri Region (Téra Department) of south-west Niger, in the middle Niger River valley about 120–150 km north-west of Niamey, near the Burkina Faso border. The main necropolis is roughly one kilometre across, set in a natural cirque framed by 10–20 m buttes. Abundant river-terrace clay fed a vast terracotta tradition; the type-site anchors a network of 800+ related sites strung along the valley.",
      "body": "Bura is the type-site of the Bura culture and was added to the UNESCO World Heritage Tentative List on 26 May 2006. Field surveys describe an ensemble of sites spanning ~450 km across western Niger — from the Malian border to the meanders of the 'W' river bend — including necropoleis, altars and habitation zones.",
      "keyFacts": [
        "Region: Tillabéri, Téra Department, south-west Niger",
        "Setting: middle Niger River valley, floodplain terrace",
        "Coordinates (primary): 13°53′53″N 1°02′20″E (verify before printing)",
        "~120–150 km north-west of Niamey",
        "Main necropolis ≈ 1 km diameter; type-site of 800+ related sites",
        "UNESCO Tentative List, 26 May 2006"
      ],
      "images": [
        {
          "url": "./assets/bura-site-map-context.png",
          "caption": "The Bura site within the wider middle-Niger valley: feeder tributaries and roads (OpenStreetMap), with the documented 250×150 km distribution corridor of the ~834 related Bura-culture sites (UNESCO TL #5045) shown schematically from the Malian border to the 'W' river bend.",
          "credit": "Terrain: SRTM (public domain) · Roads/rivers: © OpenStreetMap contributors (ODbL) · Sites: UNESCO TL #5045 / Wikipedia",
          "license": "SRTM public domain; OSM data under ODbL (attribution required)",
          "role": "hero"
        },
        {
          "url": "https://archiqoo.com/locations/bura_site_niger.php",
          "caption": "Bura Archaeological Site entry with location data and UNESCO Tentative List details (image credit ArellanoAlonso Foundation, CC BY-SA 4.0 via Wikimedia Commons).",
          "credit": "ArellanoAlonso Foundation / Wikimedia Commons",
          "license": "CC BY-SA 4.0 (verify)",
          "role": "reference"
        }
      ],
      "sources": [
        { "name": "Wikipedia", "title": "Bura archaeological site", "url": "https://en.wikipedia.org/wiki/Bura_archaeological_site", "publisher": "Wikimedia Foundation" },
        { "name": "UNESCO", "title": "Bura Archaeological Site — Tentative List #5045 (450 km / 250×150 km ensemble, 834 sites)", "url": "https://whc.unesco.org/en/tentativelists/5045", "publisher": "UNESCO World Heritage Centre" },
        { "name": "OpenStreetMap", "title": "Roads & waterways (feeder tributaries) — © OpenStreetMap contributors, ODbL", "url": "https://www.openstreetmap.org/copyright", "publisher": "OpenStreetMap (ODbL)" }
      ],
      "design": { "palette": "map ochre + node accents", "layout": "sepia topographic map of the Niger river bend with the Bura site pinned at its GPS location", "illustration": "generated by tools/make_site_map_variants.py from public-domain SRTM elevation (multidirectional hillshade) + Natural Earth hydrography, toned to the panel palette" },
      "usageNote": "Generated from public-domain data (SRTM elevation + Natural Earth) — no attribution required.",
      "status": "draft"
    },
    {
      "id": "B",
      "name": "excavation-history",
      "placardLabel": "Bura Placard B",
      "title": "The Village of the Dead",
      "subtitle": "Boubé Gado and the 1983 excavation",
      "format": "Black-and-white archival photo panel",
      "panelCaption": "Accidentally found in 1975; systematically excavated in 1983 by Nigerien archaeologist Boubé Gado.",
      "description": "A terracotta head turned up by chance near Bura-Asinda-Sikka in 1975 and was reported to the Institute for Research in Human Sciences (IRSH) at the University of Niamey. After a small 1978 dig, Boubé Gado led the first systematic excavation in 1983, opening a 25 × 20 m area and revealing over 600 (≈630) funerary urns — naming the site a necropolis, 'un village des morts'.",
      "body": "Gado published the foundational account in 1993 (\"Un 'village des morts' à Bura en République du Niger\") in the catalogue 'Vallées du Niger'. The work was modestly financed by the University of Niamey and the French Ministry of Foreign Affairs, and the Bura-Asinda exhibition toured France in the 1990s. The site has since suffered extensive looting — Le Monde reports ~90% of Niger's Bura sites damaged since 1994 — which is part of why documented excavation imagery matters.",
      "keyFacts": [
        "1975 — accidental discovery (terracotta head)",
        "1978 — first small-scale dig (IRSH, Univ. Niamey)",
        "1983 — systematic excavation by Boubé Gado, 25 × 20 m trench",
        "≈630 funerary urns recovered",
        "Foundational paper: Gado, B. (1993), 'Vallées du Niger'",
        "Heavy looting since the 1990s (Le Monde: ~90% of sites damaged)"